{
  "schema_version": "obs.recorder_trigger_event.v1",
  "trigger_name": "kmsg_warning_pattern",
  "trigger_time_mono_ns": 61000000000,
  "agent_contract": "preservation_reason_only",
  "root_cause_claim": false,
  "data_quality": {
    "dropped": false,
    "drop_count": 0,
    "throttled": false,
    "missing": [],
    "truncated": false,
    "clock_confidence": "medium",
    "notes": []
  }
}
